{
  "id": "550e8400-e29b-41d4-a716-446655440010",
  "name": "category_created",
  "timestamp": "2026-02-16T10:05:00Z",
  "app_version": "1.0.0",
  "platform": "android",
  "session_id": "550e8400-e29b-41d4-a716-446655440001",
  "properties": {
    "name": "School Snacks",
    "is_custom": true
  }
}
